<?xml version="1.0" encoding="UTF-8"?>

<xs:schema xmlns:xs ="http://www.w3.org/2001/XMLSchema">
<xs:element name="body">
    <xs:complexType>
        <xs:sequence>
            <xs:element name="list">
            <xs:complexType>
            <xs:sequence>
                <xs:element name="item" maxOccurs="unbounded">
                    <xs:complexType>
                    <xs:sequence>
                        <xs:element name="img" type="xs:string"/>
                        <xs:element name="cost" type="xs:string"/>
                        <xs:element name="description" type="xs:string"/>
                    </xs:sequence>
                    </xs:complexType>
                </xs:element>
            </xs:sequence>
            </xs:complexType>
            </xs:element>
        </xs:sequence>
    </xs:complexType>
</xs:element>
</xs:schema>