<?xml version="1.0" encoding="UTF-8"?>
<?xml-stylesheet type="text/css" href="css/styles.css"?>

<body xmlns:xsi="http://www.w3.org/2001/XMLSchema-instance" xsi:noNamespaceSchemaLocation="task3.xsd">
    <list>
        <item>
            <img></img>
            <cost> $1.49 </cost>
            <description> Вкуснейшие яблоки! </description>
        </item>

        <item>
            <img></img>
            <cost> $299 </cost>
            <description> Женёк с другой комнаты играет на гитаре просто, поэтому она здесь... </description>
        </item>

        <item>
            <img></img>
            <cost> $99 </cost>
            <description> Кросовки для крутых!!! </description>
        </item>

        <item>
            <img></img>
            <cost> $399 </cost>
            <description> Первый умный телефон! </description>
        </item>

        <item>
            <img></img>
            <cost> $49 </cost>
            <description> Персидский ковёр - очень дорогой ковёр. И именно в этом ковре... </description>
        </item>
    </list>
</body>